input_3_008|karmak, que es el que se separaron romero y karmak, tiraron del doom y karmak se va a hacer el quake el quake es el primer|karmak, que es el que se separaron romero y karmak, tiraron del doom y karmak se va a hacer el quake el quake es el primer
input_3_009|de dar el paso adelante al que aparezca el half-life el halo y que rompan todo, boludo y al metro y caí pum, en paracaídas o sea, como es|de dar el paso adelante al que aparezca el half-life el halo y que rompan todo, boludo y al metro y caí pum, en paracaídas o sea, como es
input_3_010|no me parece que inove, inovan eso, es un buen fps para consola, que era algo que venía fallando ferozmente para mi gusto|no me parece que inove, inovan eso, es un buen fps para consola, que era algo que venía fallando ferozmente para mi gusto
input_3_011|y que es el primer fps que adapta al género de metroidvania muy bien, porque sentís que estás jugando un metroid en primera persona.|y que es el primer fps que adapta al género de metroidvania muy bien, porque sentís que estás jugando un metroid en primera persona.
input_3_012|de hecho yo al principio puteaba porque yo quería más metroids en 2b, pero me lo arreglaron muy fácilmente.|de hecho yo al principio puteaba porque yo quería más metroids en 2b, pero me lo arreglaron muy fácilmente.
input_3_013|ese año pues sacaron el fusion y yo el fusion lo jugué en mi game boy advance y lo conecté, teníamos todos los cables de mierda para conectarlo al gamecube y salió.|ese año pues sacaron el fusion y yo el fusion lo jugué en mi game boy advance y lo conecté, teníamos todos los cables de mierda para conectarlo al gamecube y salió.
input_3_014|aquel traje, no me acuerdo qué poronga, había toda una movida ahí, las publicidades eran como que podían...|aquel traje, no me acuerdo qué poronga, había toda una movida ahí, las publicidades eran como que podían...
input_3_015|hacer algo con el fusion, o por ahí me estoy equivocando con el segundo, pero fue un momento así como todo muy pegado y habían sacado también el remaster del primer|hacer algo con el fusion, o por ahí me estoy equivocando con el segundo, pero fue un momento así como todo muy pegado y habían sacado también el remaster del primer
input_3_016|metro x, que me acuerdo que después de jugar ese remaster, no remaster, no, remake, ese espectáculo|metro x, que me acuerdo que después de jugar ese remaster, no remaster, no, remake, ese espectáculo
input_3_017|yo siempre recomiendo ese. volví a jugar el juego original de cartucho. yo tengo el cartucho del metroid 1. cartucho americano.|yo siempre recomiendo ese. volví a jugar el juego original de cartucho. yo tengo el cartucho del metroid 1. cartucho americano.
input_3_018|y dije, ok, este juego no me ofreció muy bien. no me lo acordaba. me acuerdo cuando era chico tuve que hacer un mapa escrito en papel.|y dije, ok, este juego no me ofreció muy bien. no me lo acordaba. me acuerdo cuando era chico tuve que hacer un mapa escrito en papel.
input_3_019|los escenarios eran muy similares, así que nada, espectacular.|los escenarios eran muy similares, así que nada, espectacular.
